<?xml version="1.0" encoding="UTF-8"?>

<konyvek   xmlns:xsi="http://www.w3.org/2001/XMLSchema-instance"
            xsi:noNamespaceSchemaLocation="DMT_konyv_mod.xsd">
	<konyv>
		<cim>
		asdasdsadas
		</cim>
		<szerzo>
		sadasdasdas
		</szerzo>
		<szereplo>
			<nev>
			asdasdasd
			</nev>
			<baratja>
			dsadasdas
			</baratja>
			<szuletett>
			1988
			</szuletett>
			<jellemzÃ©s>
			asdasdasd
			</jellemzÃ©s>
		</szereplo>
		<szereplo>
			<nev>
			asdadasd
			</nev>
			<szuletett>
			1977
			</szuletett>
			<jellemzÃ©s>
			asdasdasda
			</jellemzÃ©s>
		</szereplo>
	</konyv>
</konyvek>